key,summary,category,full_name,description,acceptable,targeted,description_cs,acceptable_cs,targeted_cs,evaluate_type,format_type,is_species_specific,alert_name,help_description
median_per_cell_unique_fragments_at_50000_RRPC,TRUE,Sequencing,Median unique fragments per cell after downsampling to 50K raw reads per cell,"The median unique fragments per cell (after downsampling to 50K raw reads per cell) is expected to be above 4,500.",5500,4500,"The median unique fragments per cell (after downsampling to 50K raw reads per cell) is expected to be above 3,500.",4500,3500,gt,int,TRUE,The median number of unique fragments per cell (at 50K raw reads per cell) is low,
median_per_cell_unique_fragments_at_30000_RRPC,TRUE,Sequencing,Median unique fragments per cell after downsampling to 30K raw reads per cell,,7000,10000,,,,gt,int,TRUE,,
median_per_cell_unique_fragments_at_10000_RRPC,FALSE,Sequencing,Median unique fragments per cell after downsampling to 10K raw reads per cell,,1000,3000,,,,gt,int,TRUE,,
median_purity,FALSE,Purity,Median barcode purity,The median barcode purity is expected to be above 98%.,0.95,0.98,The median barcode purity is expected to be above 90%.,0.85,0.90,gt,percentage,TRUE,Median barcode purity is low,"The median, across all cell barcodes, of the fraction of fragments in the barcode that align uniquely to the species assigned to the barcode."
cellranger-atac_version,TRUE,Basic,Software version used to run the pipeline,,,,,,,,,FALSE,,
reference_annotation,FALSE,Basic,Reference annotation source,,,,,,,,,FALSE,,
reference_annotation_gtf_url,FALSE,Basic,Reference annotation download URL,,,,,,,,,FALSE,,
reference_assembly,FALSE,Basic,Reference assembly name,,,,,,,,,FALSE,,
reference_assembly_accession,FALSE,Basic,Reference assembly accession code,,,,,,,,,FALSE,,
reference_assembly_fasta_url,FALSE,Basic,Reference assembly download URL,,,,,,,,,FALSE,,
reference_organism,FALSE,Basic,Reference organism,,,,,,,,,FALSE,,
putative_gelbead_doublets_found,FALSE,Cell detection,Putative gel bead doublet pairs identified,,,,,,,,int,FALSE,,
estimated_gelbead_doublet_rate,FALSE,Cell detection,Estimated rate of gel bead doublets among cell barcodes,,,,,,,,percentage,FALSE,,The estimated fraction of input cells containing two gel beads.
fraction_gelbead_doublets_cells,FALSE,Cell detection,Fraction of putative gel bead doublets called as cells,,,,,,,,percentage,FALSE,,
post_norm_median_frags_per_cell_Library,TRUE,Aggr,Post-Normalization median unique fragments per cell in library,,,,,,,,,TRUE,,"The median unique fragments per cell barcode in the library after normalization"
pre_norm_median_frags_per_cell_Library,TRUE,Aggr,Pre-Normalization median unique fragments per cell in library,,,,,,,,,TRUE,,"The median unique fragments per cell barcode in the library before normalization"
total_post_normalization_Library,TRUE,Aggr,Post-Normalization total mapped read pairs in library,,,,,,,,,TRUE,,"The total fragments (mapped read pairs) in the library after normalization"
total_pre_normalization_Library,TRUE,Aggr,Pre-Normalization total mapped read pairs in library,,,,,,,,,TRUE,,"The total fragments (mapped read pairs) in the library before normalization"
unique_post_normalization_Library,TRUE,Aggr,Post-Normalization unique fragments in library,,,,,,,,,TRUE,,"The unique fragments (mapped read pairs) in the library after normalization"
unique_pre_normalization_Library,TRUE,Aggr,Pre-Normalization unique fragments in library,,,,,,,,,TRUE,,"The unique fragments (mapped read pairs) in the library before normalization"
total_post_normalization,TRUE,Aggr,Post-Normalization total mapped read pairs,,,,,,,,,FALSE,,"The total fragments (mapped read pairs) after normalization"
total_pre_normalization,TRUE,Aggr,Pre-Normalization total mapped read pairs,,,,,,,,,FALSE,,"The total fragments (mapped read pairs) before normalization"
number_of_low_targeting_barcodes,FALSE,Cell detection,Number of barcodes identified with low peak targeting,,,,,,,,,TRUE,,
fraction_of_genome_within_2000bp_of_peaks,FALSE,Cell detection,Fraction of genome within 2000bp of called peaks,,,,,,,,,TRUE,,
num_analysis_bcs,FALSE,Reanalysis,Number of cell barcodes used in analysis,,,,,,,,,FALSE,,"The number of cell barcodes used in cell clustering, differential enrichment analysis and visualization"
putative_barcode_multiplets_found,FALSE,Cell detection,Putative barcode multiplet pairs identified,,,,,,,,,FALSE,,
